O*NET-SOC Code,Title,Task ID,Task,Task Type,Incumbents Responding,Date,Domain Source,ONETOCCSOC_2018
11-9111.00,Medical and Health Services Managers,51,"Conduct and administer fiscal operations, including accounting, planning budgets, authorizing expenditures, establishing rates for services, and coordinating financial reporting.",Core,28,06/2008,Occupational Expert,119111
11-9111.00,Medical and Health Services Managers,46,"Direct, supervise and evaluate work activities of medical, nursing, technical, clerical, service, maintenance, and other personnel.",Core,29,06/2008,Occupational Expert,119111
11-9111.00,Medical and Health Services Managers,53,"Maintain communication between governing boards, medical staff, and department heads by attending board meetings and coordinating interdepartmental functioning.",Core,29,06/2008,Occupational Expert,119111
11-9111.00,Medical and Health Services Managers,61,Review and analyze facility activities and data to aid planning and cash and risk management and to improve service utilization.,Core,29,06/2008,Occupational Expert,119111
11-9111.00,Medical and Health Services Managers,58,"Plan, implement and administer programs and services in a health care or medical facility, including personnel administration, training, and coordination of medical, nursing and physical plant staff.",Core,29,06/2008,Occupational Expert,119111
11-9111.00,Medical and Health Services Managers,48,"Direct or conduct recruitment, hiring and training of personnel.",Core,29,06/2008,Occupational Expert,119111
11-9111.00,Medical and Health Services Managers,52,"Establish work schedules and assignments for staff, according to workload, space and equipment availability.",Core,29,06/2008,Occupational Expert,119111
11-9111.00,Medical and Health Services Managers,55,"Maintain awareness of advances in medicine, computerized diagnostic and treatment equipment, data processing technology, government regulations, health insurance changes, and financing options.",Core,29,06/2008,Occupational Expert,119111
11-9111.00,Medical and Health Services Managers,54,"Monitor the use of diagnostic services, inpatient beds, facilities, and staff to ensure effective use of resources and assess the need for additional staff, equipment, and services.",Core,28,06/2008,Occupational Expert,119111
11-9111.00,Medical and Health Services Managers,49,"Develop and maintain computerized record management systems to store and process data such as personnel activities and information, and to produce reports.",Core,29,06/2008,Occupational Expert,119111
11-9111.00,Medical and Health Services Managers,47,Establish objectives and evaluative or operational criteria for units they manage.,Core,28,06/2008,Occupational Expert,119111
11-9111.00,Medical and Health Services Managers,57,"Prepare activity reports to inform management of the status and implementation plans of programs, services, and quality initiatives.",Core,28,06/2008,Occupational Expert,119111
11-9111.00,Medical and Health Services Managers,60,"Inspect facilities and recommend building or equipment modifications to ensure emergency readiness and compliance to access, safety, and sanitation regulations.",Core,28,06/2008,Occupational Expert,119111
11-9111.00,Medical and Health Services Managers,50,Develop and implement organizational policies and procedures for the facility or medical unit.,Core,29,06/2008,Occupational Expert,119111
11-9111.00,Medical and Health Services Managers,56,"Manage change in integrated health care delivery systems, such as work restructuring, technological innovations, and shifts in the focus of care.",Core,28,06/2008,Occupational Expert,119111
11-9111.00,Medical and Health Services Managers,59,"Consult with medical, business, and community groups to discuss service problems, respond to community needs, enhance public relations, coordinate activities and plans, and promote health programs.",Core,28,06/2008,Occupational Expert,119111
11-9111.00,Medical and Health Services Managers,63,Develop instructional materials and conduct in-service and community-based educational programs.,Supplemental,28,06/2008,Occupational Expert,119111
11-9111.00,Medical and Health Services Managers,62,"Develop or expand and implement medical programs or health services that promote research, rehabilitation, and community health.",Supplemental,28,06/2008,Occupational Expert,119111
21-1014.00,Mental Health Counselors,1591,Maintain confidentiality of records relating to clients' treatment.,Core,101,07/2013,Incumbent,211014
21-1014.00,Mental Health Counselors,1592,"Encourage clients to express their feelings and discuss what is happening in their lives, helping them to develop insight into themselves or their relationships.",Core,102,07/2013,Incumbent,211014
21-1014.00,Mental Health Counselors,1596,"Collect information about clients through interviews, observation, or tests.",Core,101,07/2013,Incumbent,211014
21-1014.00,Mental Health Counselors,18483,Assess patients for risk of suicide attempts.,Core,102,07/2013,Incumbent,211014
21-1014.00,Mental Health Counselors,18484,"Fill out and maintain client-related paperwork, including federal- and state-mandated forms, client diagnostic records, and progress notes.",Core,102,07/2013,Incumbent,211014
21-1014.00,Mental Health Counselors,1594,Prepare and maintain all required treatment records and reports.,Core,102,07/2013,Incumbent,211014
21-1014.00,Mental Health Counselors,1595,"Counsel clients or patients, individually or in group sessions, to assist in overcoming dependencies, adjusting to life, or making changes.",Core,102,07/2013,Incumbent,211014
21-1014.00,Mental Health Counselors,1593,Guide clients in the development of skills or strategies for dealing with their problems.,Core,101,07/2013,Incumbent,211014
21-1014.00,Mental Health Counselors,20402,Perform crisis interventions with clients.,Core,100,07/2013,Incumbent,211014
21-1014.00,Mental Health Counselors,1598,Develop and implement treatment plans based on clinical experience and knowledge.,Core,102,07/2013,Incumbent,211014
21-1014.00,Mental Health Counselors,1600,"Evaluate clients' physical or mental condition, based on review of client information.",Core,102,07/2013,Incumbent,211014
21-1014.00,Mental Health Counselors,1597,Act as client advocates to coordinate required services or to resolve emergency problems in crisis situations.,Core,100,07/2013,Incumbent,211014
21-1014.00,Mental Health Counselors,1606,Modify treatment activities or approaches as needed to comply with changes in clients' status.,Core,102,07/2013,Incumbent,211014
21-1014.00,Mental Health Counselors,1604,Evaluate the effectiveness of counseling programs on clients' progress in resolving identified problems and moving towards defined objectives.,Core,101,07/2013,Incumbent,211014
21-1014.00,Mental Health Counselors,1601,"Meet with families, probation officers, police, or other interested parties to exchange necessary information during the treatment process.",Core,102,07/2013,Incumbent,211014
21-1014.00,Mental Health Counselors,1608,Discuss with individual patients their plans for life after leaving therapy.,Core,102,07/2013,Incumbent,211014
21-1014.00,Mental Health Counselors,1599,Collaborate with other staff members to perform clinical assessments or develop treatment plans.,Core,100,07/2013,Incumbent,211014
21-1014.00,Mental Health Counselors,1603,"Counsel family members to assist them in understanding, dealing with, or supporting clients or patients.",Core,102,07/2013,Incumbent,211014
21-1014.00,Mental Health Counselors,1610,Monitor clients' use of medications.,Core,102,07/2013,Incumbent,211014
21-1014.00,Mental Health Counselors,1605,"Plan, organize, or lead structured programs of counseling, work, study, recreation, or social activities for clients.",Core,102,07/2013,Incumbent,211014
21-1014.00,Mental Health Counselors,1607,"Learn about new developments in counseling by reading professional literature, attending courses and seminars, or establishing and maintaining contact with other social service agencies.",Core,101,07/2013,Incumbent,211014
21-1014.00,Mental Health Counselors,1602,"Refer patients, clients, or family members to community resources or to specialists as necessary.",Core,100,07/2013,Incumbent,211014
21-1014.00,Mental Health Counselors,1609,Gather information about community mental health needs or resources that could be used in conjunction with therapy.,Core,102,07/2013,Incumbent,211014
21-1014.00,Mental Health Counselors,18485,"Supervise other counselors, social service staff, assistants, or graduate students.",Supplemental,101,07/2013,Incumbent,211014
21-1014.00,Mental Health Counselors,1612,Plan or conduct programs to prevent substance abuse or improve community health or counseling services.,Supplemental,102,07/2013,Incumbent,211014
21-1014.00,Mental Health Counselors,18486,"Coordinate or direct employee workshops, courses, or training about mental health issues.",Supplemental,102,07/2013,Incumbent,211014
21-1022.00,Healthcare Social Workers,258,Collaborate with other professionals to evaluate patients' medical or physical condition and to assess client needs.,Core,25,07/2014,Occupational Expert,211022
21-1022.00,Healthcare Social Workers,263,Advocate for clients or patients to resolve crises.,Core,25,07/2014,Occupational Expert,211022
21-1022.00,Healthcare Social Workers,260,"Refer patient, client, or family to community resources to assist in recovery from mental or physical illness and to provide access to services such as financial assistance, legal aid, housing, job placement or education.",Core,25,07/2014,Occupational Expert,211022
21-1022.00,Healthcare Social Workers,259,Investigate child abuse or neglect cases and take authorized protective action when necessary.,Core,25,07/2014,Occupational Expert,211022
21-1022.00,Healthcare Social Workers,261,"Counsel clients and patients in individual and group sessions to help them overcome dependencies, recover from illness, and adjust to life.",Core,25,07/2014,Occupational Expert,211022
21-1022.00,Healthcare Social Workers,15227,Plan discharge from care facility to home or other care facility.,Core,25,07/2014,Occupational Expert,211022
21-1022.00,Healthcare Social Workers,267,"Monitor, evaluate, and record client progress according to measurable goals described in treatment and care plan.",Core,25,07/2014,Occupational Expert,211022
21-1022.00,Healthcare Social Workers,266,Modify treatment plans to comply with changes in clients' status.,Core,25,07/2014,Occupational Expert,211022
21-1022.00,Healthcare Social Workers,264,Identify environmental impediments to client or patient progress through interviews and review of patient records.,Core,25,07/2014,Occupational Expert,211022
21-1022.00,Healthcare Social Workers,262,"Organize support groups or counsel family members to assist them in understanding, dealing with, and supporting the client or patient.",Core,25,07/2014,Occupational Expert,211022
21-1022.00,Healthcare Social Workers,265,"Utilize consultation data and social work experience to plan and coordinate client or patient care and rehabilitation, following through to ensure service efficacy.",Core,25,07/2014,Occupational Expert,211022
21-1022.00,Healthcare Social Workers,272,"Plan and conduct programs to combat social problems, prevent substance abuse, or improve community health and counseling services.",Core,25,07/2014,Occupational Expert,211022
21-1022.00,Healthcare Social Workers,268,Supervise and direct other workers providing services to clients or patients.,Core,25,07/2014,Occupational Expert,211022
21-1022.00,Healthcare Social Workers,270,Oversee Medicaid- and Medicare-related paperwork and recordkeeping in hospitals.,Core,25,07/2014,Occupational Expert,211022
21-1022.00,Healthcare Social Workers,269,Develop or advise on social policy and assist in community development.,Core,25,07/2014,Occupational Expert,211022
21-1022.00,Healthcare Social Workers,271,Conduct social research to advance knowledge in the social work field.,Core,25,07/2014,Occupational Expert,211022
29-1011.00,Chiropractors,6914,Evaluate the functioning of the neuromuscularskeletal system and the spine using systems of chiropractic diagnosis.,Core,61,07/2013,Incumbent,291011
29-1011.00,Chiropractors,6915,"Diagnose health problems by reviewing patients' health and medical histories, questioning, observing, and examining patients and interpreting x-rays.",Core,60,07/2013,Incumbent,291011
29-1011.00,Chiropractors,6913,Perform a series of manual adjustments to the spine or other articulations of the body to correct the musculoskeletal system.,Core,61,07/2013,Incumbent,291011
29-1011.00,Chiropractors,6918,Obtain and record patients' medical histories.,Core,61,07/2013,Incumbent,291011
29-1011.00,Chiropractors,6916,Maintain accurate case histories of patients.,Core,61,07/2013,Incumbent,291011
29-1011.00,Chiropractors,6917,Advise patients about recommended courses of treatment.,Core,61,07/2013,Incumbent,291011
29-1011.00,Chiropractors,6919,Analyze x-rays to locate the sources of patients' difficulties and to rule out fractures or diseases as sources of problems.,Core,61,07/2013,Incumbent,291011
29-1011.00,Chiropractors,6920,"Counsel patients about nutrition, exercise, sleeping habits, stress management, or other matters.",Core,61,07/2013,Incumbent,291011
29-1011.00,Chiropractors,6922,Consult with or refer patients to appropriate health practitioners when necessary.,Core,61,07/2013,Incumbent,291011
29-1011.00,Chiropractors,20403,"Recommend and arrange for diagnostic procedures, such as blood chemistry tests, saliva tests, x-rays, or other imaging procedures.",Core,61,07/2013,Incumbent,291011
29-1011.00,Chiropractors,6923,"Suggest and apply the use of supports such as straps, tapes, bandages, or braces if necessary.",Core,61,07/2013,Incumbent,291011
29-1021.00,"Dentists, General",20562,"Use masks, gloves, and safety glasses to protect patients and self from infectious diseases.",Core,72,07/2014,Incumbent,291021
29-1021.00,"Dentists, General",6926,"Examine teeth, gums, and related tissues, using dental instruments, x-rays, or other diagnostic equipment, to evaluate dental health, diagnose diseases or abnormalities, and plan appropriate treatments.",Core,73,07/2014,Incumbent,291021
29-1021.00,"Dentists, General",6925,Administer anesthetics to limit the amount of pain experienced by patients during procedures.,Core,73,07/2014,Incumbent,291021
29-1021.00,"Dentists, General",20563,"Use dental air turbines, hand instruments, dental appliances, or surgical implements.",Core,72,07/2014,Incumbent,291021
29-1021.00,"Dentists, General",6927,Formulate plan of treatment for patient's teeth and mouth tissue.,Core,73,07/2014,Incumbent,291021
29-1021.00,"Dentists, General",6931,"Diagnose and treat diseases, injuries, or malformations of teeth, gums, or related oral structures and provide preventive or corrective services.",Core,72,07/2014,Incumbent,291021
29-1021.00,"Dentists, General",6933,Write prescriptions for antibiotics or other medications.,Core,73,07/2014,Incumbent,291021
29-1021.00,"Dentists, General",6929,"Advise or instruct patients regarding preventive dental care, the causes and treatment of dental problems, or oral health care services.",Core,72,07/2014,Incumbent,291021
29-1021.00,"Dentists, General",6930,"Design, make, or fit prosthodontic appliances, such as space maintainers, bridges, or dentures, or write fabrication instructions or prescriptions for denturists or dental technicians.",Core,73,07/2014,Incumbent,291021
29-1021.00,"Dentists, General",6932,Fill pulp chamber and canal with endodontic materials.,Core,71,07/2014,Incumbent,291021
29-1021.00,"Dentists, General",6935,"Treat exposure of pulp by pulp capping, removal of pulp from pulp chamber, or root canal, using dental instruments.",Core,73,07/2014,Incumbent,291021
29-1021.00,"Dentists, General",6938,"Remove diseased tissue, using surgical instruments.",Core,72,07/2014,Incumbent,291021
29-1021.00,"Dentists, General",20564,Manage business aspects such as employing or supervising staff or handling paperwork or insurance claims.,Core,72,07/2014,Incumbent,291021
29-1021.00,"Dentists, General",6934,Analyze or evaluate dental needs to determine changes or trends in patterns of dental disease.,Core,72,07/2014,Incumbent,291021
29-1021.00,"Dentists, General",6939,Apply fluoride or sealants to teeth.,Core,73,07/2014,Incumbent,291021
29-1021.00,"Dentists, General",6936,"Eliminate irritating margins of fillings and correct occlusions, using dental instruments.",Core,73,07/2014,Incumbent,291021
29-1021.00,"Dentists, General",6937,Perform oral or periodontal surgery on the jaw or mouth.,Core,72,07/2014,Incumbent,291021
29-1021.00,"Dentists, General",6942,"Plan, organize, or maintain dental health programs.",Core,73,07/2014,Incumbent,291021
29-1021.00,"Dentists, General",6941,"Bleach, clean, or polish teeth to restore natural color.",Core,73,07/2014,Incumbent,291021
29-1021.00,"Dentists, General",6943,Produce or evaluate dental health educational materials.,Core,72,07/2014,Incumbent,291021
29-1022.00,Oral and Maxillofacial Surgeons,9370,Administer general and local anesthetics.,Core,59,07/2012,Incumbent,291022
29-1022.00,Oral and Maxillofacial Surgeons,9373,"Collaborate with other professionals, such as restorative dentists and orthodontists, to plan treatment.",Core,59,07/2012,Incumbent,291022
29-1022.00,Oral and Maxillofacial Surgeons,9372,Evaluate the position of the wisdom teeth to determine whether problems exist currently or might occur in the future.,Core,60,07/2012,Incumbent,291022
29-1022.00,Oral and Maxillofacial Surgeons,9374,"Perform surgery to prepare the mouth for dental implants, and to aid in the regeneration of deficient bone and gum tissues.",Core,59,07/2012,Incumbent,291022
29-1022.00,Oral and Maxillofacial Surgeons,9371,"Remove impacted, damaged, and non-restorable teeth.",Core,60,07/2012,Incumbent,291022
29-1022.00,Oral and Maxillofacial Surgeons,9376,"Treat infections of the oral cavity, salivary glands, jaws, and neck.",Core,60,07/2012,Incumbent,291022
29-1022.00,Oral and Maxillofacial Surgeons,9375,"Remove tumors and other abnormal growths of the oral and facial regions, using surgical instruments.",Core,59,07/2012,Incumbent,291022
29-1022.00,Oral and Maxillofacial Surgeons,9378,"Provide emergency treatment of facial injuries including facial lacerations, intra-oral lacerations, and fractured facial bones.",Core,60,07/2012,Incumbent,291022
29-1022.00,Oral and Maxillofacial Surgeons,9377,"Treat problems affecting the oral mucosa, such as mouth ulcers and infections.",Core,59,07/2012,Incumbent,291022
29-1022.00,Oral and Maxillofacial Surgeons,9380,"Restore form and function by moving skin, bone, nerves, and other tissues from other parts of the body to reconstruct the jaws and face.",Core,59,07/2012,Incumbent,291022
29-1022.00,Oral and Maxillofacial Surgeons,9379,Perform surgery on the mouth and jaws to treat conditions such as cleft lip and palate and jaw growth problems.,Core,59,07/2012,Incumbent,291022
29-1022.00,Oral and Maxillofacial Surgeons,20244,"Perform minor cosmetic procedures, such as chin and cheekbone enhancements.",Supplemental,60,07/2012,Incumbent,291022
29-1022.00,Oral and Maxillofacial Surgeons,20245,"Perform minor facial rejuvenation procedures, including the use of Botox and laser technology.",Supplemental,60,07/2012,Incumbent,291022
29-1022.00,Oral and Maxillofacial Surgeons,9382,"Treat snoring problems, using laser surgery.",Supplemental,60,07/2012,Incumbent,291022
29-1023.00,Orthodontists,7733,"Study diagnostic records, such as medical or dental histories, plaster models of the teeth, photos of a patient's face and teeth, and X-rays, to develop patient treatment plans.",Core,67,07/2012,Incumbent,291023
29-1023.00,Orthodontists,7737,Adjust dental appliances to produce and maintain normal function.,Core,67,07/2012,Incumbent,291023
29-1023.00,Orthodontists,7732,Fit dental appliances in patients' mouths to alter the position and relationship of teeth and jaws or to realign teeth.,Core,67,07/2012,Incumbent,291023
29-1023.00,Orthodontists,7734,Diagnose teeth and jaw or other dental-facial abnormalities.,Core,67,07/2012,Incumbent,291023
29-1023.00,Orthodontists,7735,"Examine patients to assess abnormalities of jaw development, tooth position, and other dental-facial structures.",Core,67,07/2012,Incumbent,291023
29-1023.00,Orthodontists,7738,Provide patients with proposed treatment plans and cost estimates.,Core,67,07/2012,Incumbent,291023
29-1023.00,Orthodontists,7739,Instruct dental officers and technical assistants in orthodontic procedures and techniques.,Core,66,07/2012,Incumbent,291023
29-1023.00,Orthodontists,7736,Prepare diagnostic and treatment records.,Core,67,07/2012,Incumbent,291023
29-1023.00,Orthodontists,7741,"Design and fabricate appliances, such as space maintainers, retainers, and labial and lingual arch wires.",Core,67,07/2012,Incumbent,291023
29-1023.00,Orthodontists,7740,Coordinate orthodontic services with other dental and medical services.,Core,67,07/2012,Incumbent,291023
29-1024.00,Prosthodontists,7745,"Measure and take impressions of patients' jaws and teeth to determine the shape and size of dental prostheses, using face bows, dental articulators, recording devices, and other materials.",Core,53,07/2012,Incumbent,291024
29-1024.00,Prosthodontists,20246,"Replace missing teeth and associated oral structures with permanent fixtures, such as implant-supported prostheses, crowns and bridges, or removable fixtures, such as dentures.",Core,52,07/2012,Incumbent,291024
29-1024.00,Prosthodontists,7744,"Design and fabricate dental prostheses, or supervise dental technicians and laboratory bench workers who construct the devices.",Core,53,07/2012,Incumbent,291024
29-1024.00,Prosthodontists,7743,"Fit prostheses to patients, making any necessary adjustments and modifications.",Core,52,07/2012,Incumbent,291024
29-1024.00,Prosthodontists,7748,"Restore function and aesthetics to traumatic injury victims, or to individuals with diseases or birth defects.",Core,53,07/2012,Incumbent,291024
29-1024.00,Prosthodontists,7746,"Collaborate with general dentists, specialists, and other health professionals to develop solutions to dental and oral health concerns.",Core,53,07/2012,Incumbent,291024
29-1024.00,Prosthodontists,7747,"Repair, reline, or rebase dentures.",Core,53,07/2012,Incumbent,291024
29-1024.00,Prosthodontists,7751,Place veneers onto teeth to conceal defects.,Core,52,07/2012,Incumbent,291024
29-1024.00,Prosthodontists,7749,Use bonding technology on the surface of the teeth to change tooth shape or to close gaps.,Core,53,07/2012,Incumbent,291024
29-1024.00,Prosthodontists,7750,Treat facial pain and jaw joint problems.,Core,53,07/2012,Incumbent,291024
29-1024.00,Prosthodontists,7752,Bleach discolored teeth to brighten and whiten them.,Core,52,07/2012,Incumbent,291024
29-1031.00,Dietitians and Nutritionists,318,"Monitor food service operations to ensure conformance to nutritional, safety, sanitation and quality standards.",Core,23,07/2014,Occupational Expert,291031
29-1031.00,Dietitians and Nutritionists,314,"Assess nutritional needs, diet restrictions and current health plans to develop and implement dietary-care plans and provide nutritional counseling.",Core,23,07/2014,Occupational Expert,291031
29-1031.00,Dietitians and Nutritionists,316,"Advise patients and their families on nutritional principles, dietary plans and diet modifications, and food selection and preparation.",Core,23,07/2014,Occupational Expert,291031
29-1031.00,Dietitians and Nutritionists,317,"Counsel individuals and groups on basic rules of good nutrition, healthy eating habits, and nutrition monitoring to improve their quality of life.",Core,23,07/2014,Occupational Expert,291031
29-1031.00,Dietitians and Nutritionists,315,Consult with physicians and health care personnel to determine nutritional needs and diet restrictions of patient or client.,Core,23,07/2014,Occupational Expert,291031
29-1031.00,Dietitians and Nutritionists,330,"Plan, conduct, and evaluate dietary, nutritional, and epidemiological research.",Core,23,07/2014,Occupational Expert,291031
29-1031.00,Dietitians and Nutritionists,333,Write research reports and other publications to document and communicate research findings.,Core,23,07/2014,Occupational Expert,291031
29-1031.00,Dietitians and Nutritionists,324,Purchase food in accordance with health and safety codes.,Core,23,07/2014,Occupational Expert,291031
29-1031.00,Dietitians and Nutritionists,326,Manage quantity food service departments or clinical and community nutrition services.,Core,23,07/2014,Occupational Expert,291031
29-1031.00,Dietitians and Nutritionists,327,Coordinate diet counseling services.,Core,23,07/2014,Occupational Expert,291031
29-1031.00,Dietitians and Nutritionists,332,"Make recommendations regarding public policy, such as nutrition labeling, food fortification, and nutrition standards for school programs.",Core,22,07/2014,Occupational Expert,291031
29-1031.00,Dietitians and Nutritionists,321,Inspect meals served for conformance to prescribed diets and standards of palatability and appearance.,Core,23,07/2014,Occupational Expert,291031
29-1031.00,Dietitians and Nutritionists,325,"Select, train and supervise workers who plan, prepare and serve meals.",Core,23,07/2014,Occupational Expert,291031
29-1031.00,Dietitians and Nutritionists,329,"Organize, develop, analyze, test, and prepare special meals such as low-fat, low-cholesterol and chemical-free meals.",Core,23,07/2014,Occupational Expert,291031
29-1031.00,Dietitians and Nutritionists,323,"Prepare and administer budgets for food, equipment and supplies.",Core,23,07/2014,Occupational Expert,291031
29-1031.00,Dietitians and Nutritionists,334,Plan and prepare grant proposals to request program funding.,Core,23,07/2014,Occupational Expert,291031
