O*NET-SOC Code,Title,Task ID,Task,Task Type,Incumbents Responding,Date,Domain Source,ONETOCCSOC_2018
29-1171.00,Nurse Practitioners,18382,"Analyze and interpret patients' histories, symptoms, physical findings, or diagnostic information to develop appropriate diagnoses.",Core,30,07/2014,Occupational Expert,291171
29-1171.00,Nurse Practitioners,18383,"Diagnose or treat acute health care problems such as illnesses, infections, or injuries.",Core,30,07/2014,Occupational Expert,291171
29-1171.00,Nurse Practitioners,18394,"Recommend diagnostic or therapeutic interventions with attention to safety, cost, invasiveness, simplicity, acceptability, adherence, and efficacy.",Core,30,07/2014,Occupational Expert,291171
29-1171.00,Nurse Practitioners,18392,"Prescribe medications based on efficacy, safety, and cost as legally authorized.",Core,30,07/2014,Occupational Expert,291171
29-1171.00,Nurse Practitioners,18378,"Educate patients about self-management of acute or chronic illnesses, tailoring instructions to patients' individual circumstances.",Core,30,07/2014,Occupational Expert,291171
29-1171.00,Nurse Practitioners,18396,"Prescribe medication dosages, routes, and frequencies based on patient characteristics such as age and gender.",Core,30,07/2014,Occupational Expert,291171
29-1171.00,Nurse Practitioners,18381,"Order, perform, or interpret the results of diagnostic tests, such as complete blood counts (CBCs), electrocardiograms (EKGs), and radiographs (x-rays).",Core,30,07/2014,Occupational Expert,291171
29-1171.00,Nurse Practitioners,18399,Maintain complete and detailed records of patients' health care plans and prognoses.,Core,30,07/2014,Occupational Expert,291171
29-1171.00,Nurse Practitioners,18395,Recommend interventions to modify behavior associated with health risks.,Core,30,07/2014,Occupational Expert,291171
29-1171.00,Nurse Practitioners,18389,"Develop treatment plans based on scientific rationale, standards of care, and professional practice guidelines.",Core,30,07/2014,Occupational Expert,291171
29-1171.00,Nurse Practitioners,18388,"Detect and respond to adverse drug reactions, with special attention to vulnerable populations such as infants, children, pregnant and lactating women, or older adults.",Core,30,07/2014,Occupational Expert,291171
29-1171.00,Nurse Practitioners,18400,"Read current literature, talk with colleagues, or participate in professional organizations or conferences to keep abreast of developments in nursing.",Core,30,07/2014,Occupational Expert,291171
29-1171.00,Nurse Practitioners,18380,"Counsel patients about drug regimens and possible side effects or interactions with other substances such as food supplements, over-the-counter (OTC) medications, or herbal remedies.",Core,30,07/2014,Occupational Expert,291171
29-1171.00,Nurse Practitioners,18384,Diagnose or treat chronic health care problems such as high blood pressure and diabetes.,Core,30,07/2014,Occupational Expert,291171
29-1171.00,Nurse Practitioners,18393,"Provide patients with information needed to promote health, reduce risk factors, or prevent disease or disability.",Core,30,07/2014,Occupational Expert,291171
29-1171.00,Nurse Practitioners,18386,"Treat or refer patients for primary care conditions, such as headaches, hypertension, urinary tract infections, upper respiratory infections, and dermatological conditions.",Core,30,07/2014,Occupational Expert,291171
29-1171.00,Nurse Practitioners,18387,Consult with or refer patients to appropriate specialists when conditions exceed the scope of practice or expertise.,Core,30,07/2014,Occupational Expert,291171
29-1171.00,Nurse Practitioners,18385,"Diagnose or treat complex, unstable, comorbid, episodic, or emergency conditions in collaboration with other health care providers as necessary.",Core,30,07/2014,Occupational Expert,291171
29-1171.00,Nurse Practitioners,18379,Schedule follow-up visits to monitor patients or evaluate health or illness care.,Core,30,07/2014,Occupational Expert,291171
29-1171.00,Nurse Practitioners,18391,Perform routine or annual physical examinations.,Core,30,07/2014,Occupational Expert,291171
29-1171.00,Nurse Practitioners,18404,Supervise or coordinate patient care or support staff activities.,Core,30,07/2014,Occupational Expert,291171
29-1171.00,Nurse Practitioners,18402,Maintain current knowledge of state legal regulations for nurse practitioner practice including reimbursement of services.,Core,30,07/2014,Occupational Expert,291171
29-1171.00,Nurse Practitioners,18398,Provide patients or caregivers with assistance in locating health care resources.,Core,30,07/2014,Occupational Expert,291171
29-1171.00,Nurse Practitioners,18403,Maintain departmental policies and procedures in areas such as safety and infection control.,Core,30,07/2014,Occupational Expert,291171
29-1171.00,Nurse Practitioners,18390,"Perform primary care procedures such as suturing, splinting, administering immunizations, taking cultures, and debriding wounds.",Core,30,07/2014,Occupational Expert,291171
29-1171.00,Nurse Practitioners,18397,Advocate for accessible health care that minimizes environmental health risks.,Core,30,07/2014,Occupational Expert,291171
29-1171.00,Nurse Practitioners,18401,"Keep abreast of regulatory processes and payer systems such as Medicare, Medicaid, managed care, and private sources.",Core,30,07/2014,Occupational Expert,291171
29-1181.00,Audiologists,18678,"Administer hearing tests and examine patients to collect information on type and degree of impairment, using specialized instruments and electronic equipment.",Core,30,07/2014,Occupational Expert,291181
29-1181.00,Audiologists,18681,"Fit, dispense, and repair assistive devices, such as hearing aids.",Core,30,07/2014,Occupational Expert,291181
29-1181.00,Audiologists,18690,"Maintain patient records at all stages, including initial and subsequent evaluation and treatment activities.",Core,30,07/2014,Occupational Expert,291181
29-1181.00,Audiologists,18673,Evaluate hearing and balance disorders to determine diagnoses and courses of treatment.,Core,30,07/2014,Occupational Expert,291181
29-1181.00,Audiologists,18674,Program and monitor cochlear implants to fit the needs of patients.,Core,29,07/2014,Occupational Expert,291181
29-1181.00,Audiologists,18672,Counsel and instruct patients and their families in techniques to improve hearing and communication related to hearing loss.,Core,30,07/2014,Occupational Expert,291181
29-1181.00,Audiologists,18688,Refer patients to additional medical or educational services if needed.,Core,30,07/2014,Occupational Expert,291181
29-1181.00,Audiologists,18686,Monitor patients' progress and provide ongoing observation of hearing or balance status.,Core,30,07/2014,Occupational Expert,291181
29-1181.00,Audiologists,7872,Educate and supervise audiology students and health care personnel.,Core,30,07/2014,Occupational Expert,291181
29-1181.00,Audiologists,18684,"Instruct patients, parents, teachers, or employers in communication strategies to maximize effective receptive communication.",Core,30,07/2014,Occupational Expert,291181
29-1181.00,Audiologists,18680,Recommend assistive devices according to patients' needs or nature of impairments.,Core,30,07/2014,Occupational Expert,291181
29-1181.00,Audiologists,18675,Participate in conferences or training to update or share knowledge of new hearing or balance disorder treatment methods or technologies.,Core,30,07/2014,Occupational Expert,291181
29-1181.00,Audiologists,18677,"Plan and conduct treatment programs for patients' hearing or balance problems, consulting with educators, physicians, nurses, psychologists, speech-language pathologists, and other health care personnel as necessary.",Core,30,07/2014,Occupational Expert,291181
29-1181.00,Audiologists,18685,Work with multidisciplinary teams to assess and rehabilitate recipients of implanted hearing devices through auditory training and counseling.,Core,30,07/2014,Occupational Expert,291181
29-1181.00,Audiologists,18682,Advise educators or other medical staff on hearing or balance topics.,Core,30,07/2014,Occupational Expert,291181
29-1181.00,Audiologists,18683,Provide information to the public on hearing or balance topics.,Core,30,07/2014,Occupational Expert,291181
29-1181.00,Audiologists,7870,Examine and clean patients' ear canals.,Core,30,07/2014,Occupational Expert,291181
29-1181.00,Audiologists,18679,"Engage in marketing activities, such as developing marketing plans, to promote business for private practices.",Core,30,07/2014,Occupational Expert,291181
29-1181.00,Audiologists,18689,"Perform administrative tasks, such as managing office functions and finances.",Core,30,07/2014,Occupational Expert,291181
29-1181.00,Audiologists,18687,"Measure noise levels in workplaces and conduct hearing conservation programs in industry, military, schools, and communities.",Core,30,07/2014,Occupational Expert,291181
29-1181.00,Audiologists,7875,Develop and supervise hearing screening programs.,Core,30,07/2014,Occupational Expert,291181
29-1181.00,Audiologists,18676,"Conduct or direct research on hearing or balance topics and report findings to help in the development of procedures, technology, or treatments.",Core,30,07/2014,Occupational Expert,291181
29-1199.01,Acupuncturists,17372,Insert needles to provide acupuncture treatment.,Core,52,07/2011,Incumbent,291199
29-1199.01,Acupuncturists,17357,"Maintain and follow standard quality, safety, environmental and infection control policies and procedures.",Core,51,07/2011,Incumbent,291199
29-1199.01,Acupuncturists,17361,"Adhere to local, state and federal laws, regulations and statutes.",Core,52,07/2011,Incumbent,291199
29-1199.01,Acupuncturists,17373,"Identify correct anatomical and proportional point locations based on patients' anatomy and positions, contraindications, and precautions related to treatments such as intradermal needles, moxibution, electricity, guasha, and bleeding.",Core,52,07/2011,Incumbent,291199
29-1199.01,Acupuncturists,17358,Maintain detailed and complete records of health care plans and prognoses.,Core,51,07/2011,Incumbent,291199
29-1199.01,Acupuncturists,17369,Analyze physical findings and medical histories to make diagnoses according to Oriental medicine traditions.,Core,52,07/2011,Incumbent,291199
29-1199.01,Acupuncturists,17362,"Treat patients using tools such as needles, cups, ear balls, seeds, pellets, and nutritional supplements.",Core,52,07/2011,Incumbent,291199
29-1199.01,Acupuncturists,17370,Develop individual treatment plans and strategies.,Core,52,07/2011,Incumbent,291199
29-1199.01,Acupuncturists,17364,"Evaluate treatment outcomes and recommend new or altered treatments as necessary to further promote, restore, or maintain health.",Core,52,07/2011,Incumbent,291199
29-1199.01,Acupuncturists,17366,Collect medical histories and general health and life style information from patients.,Core,52,07/2011,Incumbent,291199
29-1199.01,Acupuncturists,17359,"Dispense herbal formulas and inform patients of dosages and frequencies, treatment duration, possible side effects and drug interactions.",Core,52,07/2011,Incumbent,291199
29-1199.01,Acupuncturists,17365,Assess patients' general physical appearance to make diagnoses.,Core,52,07/2011,Incumbent,291199
29-1199.01,Acupuncturists,17363,"Educate patients on topics such as meditation, ergonomics, stretching, exercise, nutrition, the healing process, breathing, and relaxation techniques.",Core,52,07/2011,Incumbent,291199
29-1199.01,Acupuncturists,17356,"Formulate herbal preparations to treat conditions considering herbal properties such as taste, toxicity, effects of preparation, contraindications, and incompatibilities.",Core,52,07/2011,Incumbent,291199
29-1199.01,Acupuncturists,17360,"Consider Western medical procedures in health assessment, health care team communication, and care referrals.",Core,52,07/2011,Incumbent,291199
29-1199.01,Acupuncturists,17368,"Apply heat or cold therapy to patients using materials such as heat pads, hydrocollator packs, warm compresses, cold compresses, heat lamps, and vapor coolants.",Core,52,07/2011,Incumbent,291199
29-1199.01,Acupuncturists,17367,"Apply moxibustion directly or indirectly to patients using Chinese, non-scarring, stick, or pole moxa.",Core,52,07/2011,Incumbent,291199
29-1199.01,Acupuncturists,17371,"Treat medical conditions using techniques such as acupressure, shiatsu, and tuina.",Core,52,07/2011,Incumbent,291199
29-1199.04,Naturopathic Physicians,18411,Interview patients to document symptoms and health histories.,Core,21,07/2013,Occupational Expert,291199
29-1199.04,Naturopathic Physicians,18418,"Document patients' histories, including identifying data, chief complaints, illnesses, previous medical or family histories, or psychosocial characteristics.",Core,21,07/2013,Occupational Expert,291199
29-1199.04,Naturopathic Physicians,18409,"Administer, dispense, or prescribe natural medicines such as food or botanical extracts, herbs, dietary supplements, vitamins, nutraceuticals, and amino acids.",Core,21,07/2013,Occupational Expert,291199
29-1199.04,Naturopathic Physicians,18413,Advise patients about therapeutic exercise and nutritional medicine regimens.,Core,21,07/2013,Occupational Expert,291199
29-1199.04,Naturopathic Physicians,18410,Conduct physical examinations and physiological function tests for diagnostic purposes.,Core,21,07/2013,Occupational Expert,291199
29-1199.04,Naturopathic Physicians,18414,"Diagnose health conditions based on patients' symptoms and health histories, laboratory and diagnostic radiology test results, or other physiological measurements, such as electrocardiograms and electroencephalographs.",Core,21,07/2013,Occupational Expert,291199
29-1199.04,Naturopathic Physicians,18412,Educate patients about health care management.,Core,21,07/2013,Occupational Expert,291199
29-1199.04,Naturopathic Physicians,18406,"Maintain professional development through activities such as post-graduate education, continuing education, preceptorships, and residency programs.",Core,21,07/2013,Occupational Expert,291199
29-1199.04,Naturopathic Physicians,18408,"Administer treatments or therapies, such as homeopathy, hydrotherapy, Oriental or Ayurvedic medicine, electrotherapy and diathermy, using physical agents including air, heat, cold, water, sound, or ultraviolet light to catalyze the body to heal itself.",Core,21,07/2013,Occupational Expert,291199
29-1199.04,Naturopathic Physicians,18420,"Consult with other health professionals to provide optimal patient care, referring patients to traditional health care professionals as necessary.",Core,21,07/2013,Occupational Expert,291199
29-1199.04,Naturopathic Physicians,18417,Prescribe synthetic drugs under the supervision of medical doctors or within the allowances of regulatory bodies.,Core,21,07/2013,Occupational Expert,291199
29-1199.04,Naturopathic Physicians,18407,"Order diagnostic imaging procedures such as radiographs (x-rays), ultrasounds, mammograms, and bone densitometry tests, or refer patients to other health professionals for these procedures.",Core,21,07/2013,Occupational Expert,291199
29-1199.04,Naturopathic Physicians,18424,Obtain medical records from previous physicians or other health care providers for the purpose of patient evaluation.,Core,21,07/2013,Occupational Expert,291199
29-1199.04,Naturopathic Physicians,18405,"Perform mobilizations and high-velocity adjustments to joints or soft tissues, using principles of massage, stretching, or resistance.",Core,21,07/2013,Occupational Expert,291199
29-1199.04,Naturopathic Physicians,18415,Perform venipuncture or skin pricking to collect blood samples.,Core,21,07/2013,Occupational Expert,291199
29-1199.04,Naturopathic Physicians,18423,Conduct periodic public health maintenance activities such as immunizations and screenings for diseases and disease risk factors.,Core,21,07/2013,Occupational Expert,291199
29-1199.04,Naturopathic Physicians,18422,Monitor updates from public health agencies to keep abreast of health trends.,Core,21,07/2013,Occupational Expert,291199
29-1199.04,Naturopathic Physicians,18419,"Perform minor surgical procedures, such as removing warts, moles, or cysts, sampling tissues for skin cancer or lipomas, and applying or removing sutures.",Supplemental,20,07/2013,Occupational Expert,291199
29-1199.04,Naturopathic Physicians,18421,"Report patterns of patients' health conditions, such as disease status and births, to public health agencies.",Supplemental,21,07/2013,Occupational Expert,291199
29-1199.04,Naturopathic Physicians,18416,"Treat minor cuts, abrasions, or contusions.",Supplemental,21,07/2013,Occupational Expert,291199
29-1199.05,Orthoptists,18429,"Examine patients with problems related to ocular motility, binocular vision, amblyopia, or strabismus.",Core,35,06/2009,Occupational Expert,291199
29-1199.05,Orthoptists,18430,"Evaluate, diagnose, or treat disorders of the visual system with an emphasis on binocular vision or abnormal eye movements.",Core,35,06/2009,Occupational Expert,291199
29-1199.05,Orthoptists,18428,"Perform diagnostic tests or measurements, such as motor testing, visual acuity testing, lensometry, retinoscopy, and color vision testing.",Core,35,06/2009,Occupational Expert,291199
29-1199.05,Orthoptists,18427,"Develop nonsurgical treatment plans for patients with conditions such as strabismus, nystagmus, and other visual disorders.",Core,35,06/2009,Occupational Expert,291199
29-1199.05,Orthoptists,18432,Provide instructions to patients or family members concerning diagnoses or treatment plans.,Core,35,06/2009,Occupational Expert,291199
29-1199.05,Orthoptists,18426,"Provide nonsurgical interventions, including corrective lenses, patches, drops, fusion exercises, or stereograms, to treat conditions such as strabismus, heterophoria, and convergence insufficiency.",Core,35,06/2009,Occupational Expert,291199
29-1199.05,Orthoptists,18434,Develop or use special test and communication techniques to facilitate diagnosis and treatment of children or disabled patients.,Core,34,06/2009,Occupational Expert,291199
29-1199.05,Orthoptists,18431,Interpret clinical or diagnostic test results.,Core,35,06/2009,Occupational Expert,291199
29-1199.05,Orthoptists,18433,Refer patients to ophthalmic surgeons or other physicians.,Core,35,06/2009,Occupational Expert,291199
29-1199.05,Orthoptists,18440,"Provide training related to clinical methods or orthoptics to students, resident physicians, or other health professionals.",Core,35,06/2009,Occupational Expert,291199
29-1199.05,Orthoptists,18436,Prepare diagnostic or treatment reports for other medical practitioners or therapists.,Core,35,06/2009,Occupational Expert,291199
29-1199.05,Orthoptists,18435,"Collaborate with ophthalmologists, optometrists, or other specialists in the diagnosis, treatment, or management of conditions such as glaucoma, cataracts, and retinal diseases.",Core,35,06/2009,Occupational Expert,291199
29-1199.05,Orthoptists,18425,"Assist ophthalmologists in diagnostic ophthalmic procedures, such as ultrasonography, fundus photography, and tonometry.",Core,35,06/2009,Occupational Expert,291199
29-1199.05,Orthoptists,18439,Perform vision screening of children in schools or community health centers.,Core,34,06/2009,Occupational Expert,291199
29-1199.05,Orthoptists,18437,Participate in clinical research projects.,Supplemental,35,06/2009,Occupational Expert,291199
29-1199.05,Orthoptists,18438,Present or publish scientific papers.,Supplemental,35,06/2009,Occupational Expert,291199
29-2011.00,Medical and Clinical Laboratory Technologists,1887,"Conduct chemical analysis of body fluids, including blood, urine, or spinal fluid, to determine presence of normal or abnormal components.",Core,108,07/2013,Incumbent,292011
29-2011.00,Medical and Clinical Laboratory Technologists,1886,Analyze laboratory findings to check the accuracy of the results.,Core,108,07/2013,Incumbent,292011
29-2011.00,Medical and Clinical Laboratory Technologists,1888,"Operate, calibrate, or maintain equipment used in quantitative or qualitative analysis, such as spectrophotometers, calorimeters, flame photometers, or computer-controlled analyzers.",Core,107,07/2013,Incumbent,292011
29-2011.00,Medical and Clinical Laboratory Technologists,15233,"Collect and study blood samples to determine the number of cells, their morphology, or their blood group, blood type, or compatibility for transfusion purposes, using microscopic techniques.",Core,108,07/2013,Incumbent,292011
29-2011.00,Medical and Clinical Laboratory Technologists,1889,Enter data from analysis of medical tests or clinical results into computer for storage.,Core,108,07/2013,Incumbent,292011
29-2011.00,Medical and Clinical Laboratory Technologists,15232,Establish or monitor quality assurance programs or activities to ensure the accuracy of laboratory results.,Core,108,07/2013,Incumbent,292011
29-2011.00,Medical and Clinical Laboratory Technologists,1890,Analyze samples of biological material for chemical content or reaction.,Core,107,07/2013,Incumbent,292011
29-2011.00,Medical and Clinical Laboratory Technologists,1892,"Set up, clean, and maintain laboratory equipment.",Core,108,07/2013,Incumbent,292011
29-2011.00,Medical and Clinical Laboratory Technologists,1893,"Provide technical information about test results to physicians, family members, or researchers.",Core,108,07/2013,Incumbent,292011
29-2011.00,Medical and Clinical Laboratory Technologists,1896,"Cultivate, isolate, or assist in identifying microbial organisms or perform various tests on these microorganisms.",Core,108,07/2013,Incumbent,292011
29-2011.00,Medical and Clinical Laboratory Technologists,1894,"Supervise, train, or direct lab assistants, medical and clinical laboratory technicians or technologists, or other medical laboratory workers engaged in laboratory testing.",Core,108,07/2013,Incumbent,292011
29-2011.00,Medical and Clinical Laboratory Technologists,1895,"Develop, standardize, evaluate, or modify procedures, techniques, or tests used in the analysis of specimens or in medical laboratory experiments.",Core,108,07/2013,Incumbent,292011
29-2011.00,Medical and Clinical Laboratory Technologists,1901,"Harvest cell cultures at optimum time, based on knowledge of cell cycle differences and culture conditions.",Supplemental,108,07/2013,Incumbent,292011
29-2011.00,Medical and Clinical Laboratory Technologists,1899,"Select and prepare specimens and media for cell cultures, using aseptic technique and knowledge of medium components and cell requirements.",Supplemental,108,07/2013,Incumbent,292011
29-2011.00,Medical and Clinical Laboratory Technologists,1898,"Obtain, cut, stain, and mount biological material on slides for microscopic study and diagnosis, following standard laboratory procedures.",Supplemental,108,07/2013,Incumbent,292011
29-2011.00,Medical and Clinical Laboratory Technologists,1900,Conduct medical research under direction of microbiologist or biochemist.,Supplemental,108,07/2013,Incumbent,292011
29-2011.01,Cytogenetic Technologists,17389,"Count numbers of chromosomes and identify the structural abnormalities by viewing culture slides through microscopes, light microscopes, or photomicroscopes.",Core,26,07/2014,Occupational Expert,292011
29-2011.01,Cytogenetic Technologists,17390,"Arrange and attach chromosomes in numbered pairs on karyotype charts, using standard genetics laboratory practices and nomenclature, to identify normal or abnormal chromosomes.",Core,26,07/2014,Occupational Expert,292011
29-2011.01,Cytogenetic Technologists,17391,"Analyze chromosomes found in biological specimens to aid diagnoses and treatments for genetic diseases such as congenital birth defects, fertility problems, and hematological disorders.",Core,26,07/2014,Occupational Expert,292011
29-2011.01,Cytogenetic Technologists,17385,Examine chromosomes found in biological specimens to detect abnormalities.,Core,26,07/2014,Occupational Expert,292011
29-2011.01,Cytogenetic Technologists,17383,Create chromosome images using computer imaging systems.,Core,26,07/2014,Occupational Expert,292011
29-2011.01,Cytogenetic Technologists,20565,Select appropriate culturing system or procedure based on specimen type and reason for referral.,Core,26,07/2014,Occupational Expert,292011
29-2011.01,Cytogenetic Technologists,17382,"Harvest cell cultures using substances such as mitotic arrestants, cell releasing agents, and cell fixatives.",Core,26,07/2014,Occupational Expert,292011
29-2011.01,Cytogenetic Technologists,17376,Summarize test results and report to appropriate authorities.,Core,26,07/2014,Occupational Expert,292011
29-2011.01,Cytogenetic Technologists,20566,"Describe chromosome, FISH and aCGH analysis results in Internations System of Cytogenetic Nomenclature (ISCN) language.",Core,26,07/2014,Occupational Expert,292011
29-2011.01,Cytogenetic Technologists,17380,Prepare slides of cell cultures following standard procedures.,Core,26,07/2014,Occupational Expert,292011
29-2011.01,Cytogenetic Technologists,17386,"Recognize and report abnormalities in the color, size, shape, composition, or pattern of cells.",Core,26,07/2014,Occupational Expert,292011
29-2011.01,Cytogenetic Technologists,17388,"Prepare biological specimens such as amniotic fluids, bone marrow, tumors, chorionic villi, and blood, for chromosome examinations.",Core,26,07/2014,Occupational Expert,292011
29-2011.01,Cytogenetic Technologists,20567,"Extract, measure, dilute as appropriate, label, and prepare DNA for array analysis.",Core,26,07/2014,Occupational Expert,292011
29-2011.01,Cytogenetic Technologists,17377,"Select or prepare specimens and media for cell cultures using aseptic techniques, knowledge of medium components, or cell nutritional requirements.",Core,26,07/2014,Occupational Expert,292011
29-2011.01,Cytogenetic Technologists,20568,"Input details of specimen processing, analysis, and technical issues into logs or laboratory information systems (LIS).",Core,26,07/2014,Occupational Expert,292011
