O*NET-SOC Code,Title,Task ID,Task,Task Type,Incumbents Responding,Date,Domain Source,ONETOCCSOC_2018
29-1122.00,Occupational Therapists,358,Plan and implement programs and social activities to help patients learn work or school skills and adjust to handicaps.,Core,21,07/2014,Occupational Expert,291122
29-1122.00,Occupational Therapists,354,"Help clients improve decision making, abstract reasoning, memory, sequencing, coordination, and perceptual skills, using computer programs.",Core,21,07/2014,Occupational Expert,291122
29-1122.00,Occupational Therapists,356,Provide training and supervision in therapy techniques and objectives for students or nurses and other medical staff.,Core,21,07/2014,Occupational Expert,291122
29-1122.00,Occupational Therapists,361,Conduct research in occupational therapy.,Core,21,07/2014,Occupational Expert,291122
29-1122.00,Occupational Therapists,360,Advise on health risks in the workplace or on health-related transition to retirement.,Core,21,07/2014,Occupational Expert,291122
29-1122.00,Occupational Therapists,362,Provide patients with assistance in locating or holding jobs.,Supplemental,21,07/2014,Occupational Expert,291122
29-1122.01,"Low Vision Therapists, Orientation and Mobility Specialists, and Vision Rehabilitation Therapists",17336,"Teach cane skills including cane use with a guide, diagonal techniques, and two-point touches.",Core,25,07/2014,Occupational Expert,291122
29-1122.01,"Low Vision Therapists, Orientation and Mobility Specialists, and Vision Rehabilitation Therapists",17346,"Train clients to use tactile, auditory, kinesthetic, olfactory, and propioceptive information.",Core,25,07/2014,Occupational Expert,291122
29-1122.01,"Low Vision Therapists, Orientation and Mobility Specialists, and Vision Rehabilitation Therapists",17351,"Assess clients' functioning in areas such as vision, orientation and mobility skills, social and emotional issues, cognition, physical abilities, and personal goals.",Core,25,07/2014,Occupational Expert,291122
29-1122.01,"Low Vision Therapists, Orientation and Mobility Specialists, and Vision Rehabilitation Therapists",17345,Teach clients to travel independently using a variety of actual or simulated travel situations or exercises.,Core,25,07/2014,Occupational Expert,291122
29-1122.01,"Low Vision Therapists, Orientation and Mobility Specialists, and Vision Rehabilitation Therapists",17348,Monitor clients' progress to determine whether changes in rehabilitation plans are needed.,Core,25,07/2014,Occupational Expert,291122
29-1122.01,"Low Vision Therapists, Orientation and Mobility Specialists, and Vision Rehabilitation Therapists",17350,"Develop rehabilitation or instructional plans collaboratively with clients, based on results of assessments, needs, and goals.",Core,25,07/2014,Occupational Expert,291122
29-1122.01,"Low Vision Therapists, Orientation and Mobility Specialists, and Vision Rehabilitation Therapists",17355,"Recommend appropriate mobility devices or systems such as human guides, dog guides, long canes, electronic travel aids (ETAs), and other adaptive mobility devices (AMDs).",Core,25,07/2014,Occupational Expert,291122
29-1122.01,"Low Vision Therapists, Orientation and Mobility Specialists, and Vision Rehabilitation Therapists",17352,"Train clients with visual impairments to use mobility devices or systems such as human guides, dog guides, electronic travel aids (ETAs), and other adaptive mobility devices (AMDs).",Core,25,07/2014,Occupational Expert,291122
29-1122.01,"Low Vision Therapists, Orientation and Mobility Specialists, and Vision Rehabilitation Therapists",17342,"Collaborate with specialists, such as rehabilitation counselors, speech pathologists, and occupational therapists, to provide client solutions.",Core,25,07/2014,Occupational Expert,291122
29-1122.01,"Low Vision Therapists, Orientation and Mobility Specialists, and Vision Rehabilitation Therapists",17338,"Provide consultation, support, or education to groups such as parents and teachers.",Core,25,07/2014,Occupational Expert,291122
29-1122.01,"Low Vision Therapists, Orientation and Mobility Specialists, and Vision Rehabilitation Therapists",17339,"Participate in professional development activities such as reading literature, continuing education, attending conferences, and collaborating with colleagues.",Core,25,07/2014,Occupational Expert,291122
29-1122.01,"Low Vision Therapists, Orientation and Mobility Specialists, and Vision Rehabilitation Therapists",17347,"Train clients to use adaptive equipment such as large print, reading stands, lamps, writing implements, software, and electronic devices.",Core,25,07/2014,Occupational Expert,291122
29-1122.01,"Low Vision Therapists, Orientation and Mobility Specialists, and Vision Rehabilitation Therapists",17349,"Write reports or complete forms to document assessments, training, progress, or follow-up outcomes.",Core,25,07/2014,Occupational Expert,291122
29-1122.01,"Low Vision Therapists, Orientation and Mobility Specialists, and Vision Rehabilitation Therapists",17343,Administer tests and interpret test results to develop rehabilitation plans for clients.,Core,25,07/2014,Occupational Expert,291122
29-1122.01,"Low Vision Therapists, Orientation and Mobility Specialists, and Vision Rehabilitation Therapists",17337,"Refer clients to services, such as eye care, health care, rehabilitation, and counseling, to enhance visual and life functioning or when condition exceeds scope of practice.",Core,25,07/2014,Occupational Expert,291122
29-1122.01,"Low Vision Therapists, Orientation and Mobility Specialists, and Vision Rehabilitation Therapists",17354,"Teach independent living skills or techniques such as adaptive eating, medication management, diabetes management, and personal management.",Core,25,07/2014,Occupational Expert,291122
29-1122.01,"Low Vision Therapists, Orientation and Mobility Specialists, and Vision Rehabilitation Therapists",17340,"Obtain, distribute, or maintain low vision devices.",Core,25,07/2014,Occupational Expert,291122
29-1122.01,"Low Vision Therapists, Orientation and Mobility Specialists, and Vision Rehabilitation Therapists",17353,"Identify visual impairments related to basic life skills in areas such as self-care, literacy, communication, health management, home management, and meal preparation.",Core,25,07/2014,Occupational Expert,291122
29-1122.01,"Low Vision Therapists, Orientation and Mobility Specialists, and Vision Rehabilitation Therapists",17344,Train clients to read or write Braille.,Supplemental,25,07/2014,Occupational Expert,291122
29-1122.01,"Low Vision Therapists, Orientation and Mobility Specialists, and Vision Rehabilitation Therapists",17341,"Design instructional programs to improve communication using devices such as slates and styluses, braillers, keyboards, adaptive handwriting devices, talking book machines, digital books, and optical character readers (OCRs).",Supplemental,25,07/2014,Occupational Expert,291122
29-1123.00,Physical Therapists,363,"Plan, prepare, or carry out individually designed programs of physical treatment to maintain, improve, or restore physical functioning, alleviate pain, or prevent physical dysfunction in patients.",Core,132,07/2013,Incumbent,291123
29-1123.00,Physical Therapists,364,"Perform and document an initial exam, evaluating data to identify problems and determine a diagnosis prior to intervention.",Core,130,07/2013,Incumbent,291123
29-1123.00,Physical Therapists,365,Evaluate effects of treatment at various stages and adjust treatments to achieve maximum benefit.,Core,131,07/2013,Incumbent,291123
29-1123.00,Physical Therapists,374,"Identify and document goals, anticipated progress, and plans for reevaluation.",Core,131,07/2013,Incumbent,291123
29-1123.00,Physical Therapists,370,"Record prognosis, treatment, response, and progress in patient's chart or enter information into computer.",Core,131,07/2013,Incumbent,291123
29-1123.00,Physical Therapists,371,Obtain patients' informed consent to proposed interventions.,Core,128,07/2013,Incumbent,291123
29-1123.00,Physical Therapists,373,"Test and measure patient's strength, motor development and function, sensory perception, functional capacity, or respiratory or circulatory efficiency and record data.",Core,131,07/2013,Incumbent,291123
29-1123.00,Physical Therapists,369,Review physician's referral and patient's medical records to help determine diagnosis and physical therapy treatment required.,Core,131,07/2013,Incumbent,291123
29-1123.00,Physical Therapists,372,Discharge patient from physical therapy when goals or projected outcomes have been attained and provide for appropriate follow-up care or referrals.,Core,132,07/2013,Incumbent,291123
29-1123.00,Physical Therapists,367,Instruct patient and family in treatment procedures to be continued at home.,Core,131,07/2013,Incumbent,291123
29-1123.00,Physical Therapists,366,"Administer manual exercises, massage, or traction to help relieve pain, increase patient strength, or decrease or prevent deformity or crippling.",Core,132,07/2013,Incumbent,291123
29-1123.00,Physical Therapists,377,"Direct, supervise, assess, and communicate with supportive personnel.",Core,132,07/2013,Incumbent,291123
29-1123.00,Physical Therapists,20407,Inform patients and refer to appropriate practitioners when diagnosis reveals findings outside physical therapy.,Core,131,07/2013,Incumbent,291123
29-1123.00,Physical Therapists,375,"Provide information to the patient about the proposed intervention, its material risks and expected benefits, and any reasonable alternatives.",Core,128,07/2013,Incumbent,291123
29-1123.00,Physical Therapists,368,"Confer with the patient, medical practitioners, or appropriate others to plan, implement, or assess the intervention program.",Core,132,07/2013,Incumbent,291123
29-1123.00,Physical Therapists,381,"Provide educational information about physical therapy or physical therapists, injury prevention, ergonomics, or ways to promote health.",Core,128,07/2013,Incumbent,291123
29-1123.00,Physical Therapists,378,"Administer treatment involving application of physical agents, using equipment, moist packs, ultraviolet or infrared lamps, or ultrasound machines.",Core,131,07/2013,Incumbent,291123
29-1123.00,Physical Therapists,379,Teach physical therapy students or those in other health professions.,Core,132,07/2013,Incumbent,291123
29-1123.00,Physical Therapists,382,Refer clients to community resources or services.,Core,131,07/2013,Incumbent,291123
29-1123.00,Physical Therapists,380,"Evaluate, fit, or adjust prosthetic or orthotic devices or recommend modification to orthotist.",Core,132,07/2013,Incumbent,291123
29-1123.00,Physical Therapists,383,Conduct or support research and apply research findings to practice.,Core,129,07/2013,Incumbent,291123
29-1123.00,Physical Therapists,384,Participate in community or community agency activities or help to formulate public policy.,Core,131,07/2013,Incumbent,291123
29-1123.00,Physical Therapists,386,Direct group rehabilitation activities.,Supplemental,130,07/2013,Incumbent,291123
29-1123.00,Physical Therapists,385,"Construct, maintain, or repair medical supportive devices.",Supplemental,132,07/2013,Incumbent,291123
29-1124.00,Radiation Therapists,4086,"Position patients for treatment with accuracy, according to prescription.",Core,103,07/2013,Incumbent,291124
29-1124.00,Radiation Therapists,4085,"Administer prescribed doses of radiation to specific body parts, using radiation therapy equipment according to established practices and standards.",Core,103,07/2013,Incumbent,291124
29-1124.00,Radiation Therapists,4088,"Follow principles of radiation protection for patient, self, and others.",Core,102,07/2013,Incumbent,291124
29-1124.00,Radiation Therapists,4090,"Review prescription, diagnosis, patient chart, and identification.",Core,102,07/2013,Incumbent,291124
29-1124.00,Radiation Therapists,4091,"Conduct most treatment sessions independently, in accordance with the long-term treatment plan and under the general direction of the patient's physician.",Core,103,07/2013,Incumbent,291124
29-1124.00,Radiation Therapists,4087,Enter data into computer and set controls to operate or adjust equipment or regulate dosage.,Core,103,07/2013,Incumbent,291124
29-1124.00,Radiation Therapists,4092,Check radiation therapy equipment to ensure proper operation.,Core,103,07/2013,Incumbent,291124
29-1124.00,Radiation Therapists,4093,Observe and reassure patients during treatment and report unusual reactions to physician or turn equipment off if unexpected adverse reactions occur.,Core,102,07/2013,Incumbent,291124
29-1124.00,Radiation Therapists,4095,"Educate, prepare, and reassure patients and their families by answering questions, providing physical assistance, and reinforcing physicians' advice regarding treatment reactions or post-treatment care.",Core,103,07/2013,Incumbent,291124
29-1124.00,Radiation Therapists,4089,"Maintain records, reports, or files as required, including such information as radiation dosages, equipment settings, or patients' reactions.",Core,102,07/2013,Incumbent,291124
29-1124.00,Radiation Therapists,4094,"Check for side effects, such as skin irritation, nausea, or hair loss to assess patients' reaction to treatment.",Core,103,07/2013,Incumbent,291124
29-1124.00,Radiation Therapists,4097,"Prepare or construct equipment, such as immobilization, treatment, or protection devices.",Core,103,07/2013,Incumbent,291124
29-1124.00,Radiation Therapists,4099,"Help physicians, radiation oncologists, or clinical physicists to prepare physical or technical aspects of radiation treatment plans, using information about patient condition and anatomy.",Core,103,07/2013,Incumbent,291124
29-1124.00,Radiation Therapists,4096,Calculate actual treatment dosages delivered during each session.,Core,101,07/2013,Incumbent,291124
29-1124.00,Radiation Therapists,4098,Photograph treated area of patient and process film.,Core,103,07/2013,Incumbent,291124
29-1124.00,Radiation Therapists,4101,Act as liaison with physicist and supportive care personnel.,Core,102,07/2013,Incumbent,291124
29-1124.00,Radiation Therapists,20408,Schedule patients for treatment times.,Core,103,07/2013,Incumbent,291124
29-1124.00,Radiation Therapists,4102,Provide assistance to other healthcare personnel during dosimetry procedures and tumor localization.,Core,102,07/2013,Incumbent,291124
29-1124.00,Radiation Therapists,4100,Train or supervise student or subordinate radiotherapy technologists.,Core,103,07/2013,Incumbent,291124
29-1124.00,Radiation Therapists,4103,Implement appropriate follow-up care plans.,Supplemental,102,07/2013,Incumbent,291124
29-1124.00,Radiation Therapists,4104,"Store, sterilize, or prepare the special applicators containing the radioactive substance implanted by the physician.",Supplemental,102,07/2013,Incumbent,291124
29-1124.00,Radiation Therapists,4105,"Assist in the preparation of sealed radioactive materials, such as cobalt, radium, cesium, or isotopes, for use in radiation treatments.",Supplemental,102,07/2013,Incumbent,291124
29-1125.00,Recreational Therapists,392,Conduct therapy sessions to improve patients' mental and physical well-being.,Core,26,06/2008,Occupational Expert,291125
29-1125.00,Recreational Therapists,387,"Observe, analyze, and record patients' participation, reactions, and progress during treatment sessions, modifying treatment programs as needed.",Core,26,06/2008,Occupational Expert,291125
29-1125.00,Recreational Therapists,395,"Plan, organize, direct and participate in treatment programs and activities to facilitate patients' rehabilitation, help them integrate into the community and prevent further medical problems.",Core,26,06/2008,Occupational Expert,291125
29-1125.00,Recreational Therapists,388,"Develop treatment plan to meet needs of patient, based on needs assessment, patient interests and objectives of therapy.",Core,26,06/2008,Occupational Expert,291125
29-1125.00,Recreational Therapists,396,Prepare and submit reports and charts to treatment team to reflect patients' reactions and evidence of progress or regression.,Core,26,06/2008,Occupational Expert,291125
29-1125.00,Recreational Therapists,394,"Obtain information from medical records, medical staff, family members and the patients themselves to assess patients' capabilities, needs and interests.",Core,26,06/2008,Occupational Expert,291125
29-1125.00,Recreational Therapists,390,Counsel and encourage patients to develop leisure activities.,Core,26,06/2008,Occupational Expert,291125
29-1125.00,Recreational Therapists,393,"Instruct patient in activities and techniques, such as sports, dance, music, art or relaxation techniques, designed to meet their specific physical or psychological needs.",Core,26,06/2008,Occupational Expert,291125
29-1125.00,Recreational Therapists,391,Confer with members of treatment team to plan and evaluate therapy programs.,Core,26,06/2008,Occupational Expert,291125
29-1125.00,Recreational Therapists,389,"Encourage clients with special needs and circumstances to acquire new skills and get involved in health-promoting leisure activities, such as sports, games, arts and crafts, and gardening.",Core,26,06/2008,Occupational Expert,291125
29-1125.01,Art Therapists,19153,"Talk with clients during art or other therapy sessions to build rapport, acknowledge their progress, or reflect upon their reactions to the artistic process.",Core,21,07/2014,Occupational Expert,291125
29-1125.01,Art Therapists,19143,"Conduct art therapy sessions providing guided self-expression experiences to help clients recover from or cope with cognitive, emotional, or physical impairments.",Core,21,07/2014,Occupational Expert,291125
29-1125.01,Art Therapists,19146,Design art therapy sessions or programs to meet client's goals or objectives.,Core,21,07/2014,Occupational Expert,291125
29-1125.01,Art Therapists,19154,"Write treatment plans, case summaries, or progress or other reports related to individual clients or client groups.",Core,21,07/2014,Occupational Expert,291125
29-1125.01,Art Therapists,19151,"Observe and document client reactions, progress, or other outcomes related to art therapy.",Core,21,07/2014,Occupational Expert,291125
29-1125.01,Art Therapists,19148,Establish goals or objectives for art therapy sessions in consultation with clients or site administrators.,Core,21,07/2014,Occupational Expert,291125
29-1125.01,Art Therapists,19158,"Gather client information from sources such as case documentation, client observation, or interviews of client or family members.",Core,21,07/2014,Occupational Expert,291125
29-1125.01,Art Therapists,19147,"Develop individualized treatment plans that incorporate studio art therapy, counseling, or psychotherapy techniques.",Core,21,07/2014,Occupational Expert,291125
29-1125.01,Art Therapists,19141,"Assess client needs or disorders, using drawing, painting, sculpting, or other artistic processes.",Core,21,07/2014,Occupational Expert,291125
29-1125.01,Art Therapists,19142,"Communicate client assessment findings and recommendations in oral, written, audio, video, or other forms.",Core,21,07/2014,Occupational Expert,291125
29-1125.01,Art Therapists,19140,Analyze or synthesize client data to draw conclusions or make recommendations for art therapy.,Core,21,07/2014,Occupational Expert,291125
29-1125.01,Art Therapists,19145,"Customize art therapy programs for specific client populations, such as those in schools, nursing homes, wellness centers, prisons, shelters, or hospitals.",Core,20,07/2014,Occupational Expert,291125
29-1125.01,Art Therapists,19161,Select or prepare artistic media or related equipment or devices to accomplish therapy session objectives.,Core,21,07/2014,Occupational Expert,291125
29-1125.01,Art Therapists,19144,"Confer with other professionals on client's treatment team to develop, coordinate, or integrate treatment plans.",Core,21,07/2014,Occupational Expert,291125
29-1125.01,Art Therapists,19159,Recommend or purchase needed art supplies or equipment.,Core,20,07/2014,Occupational Expert,291125
29-1125.01,Art Therapists,19150,"Interpret the artistic creations of clients to assess their functioning, needs, or progress.",Core,21,07/2014,Occupational Expert,291125
29-1125.01,Art Therapists,19162,"Supervise staff, volunteers, practicum students, or interns.",Core,21,07/2014,Occupational Expert,291125
29-1125.01,Art Therapists,19139,Analyze data to determine the effectiveness of treatments or therapy approaches.,Core,21,07/2014,Occupational Expert,291125
29-1125.01,Art Therapists,19160,"Review research or literature in art therapy, psychology, or related disciplines.",Core,21,07/2014,Occupational Expert,291125
29-1125.01,Art Therapists,19163,"Teach art therapy techniques or processes to artists, interns, volunteers, or others.",Core,21,07/2014,Occupational Expert,291125
29-1125.01,Art Therapists,19149,"Instruct individuals or groups in the use of art media, such as paint, clay, or yarn.",Core,21,07/2014,Occupational Expert,291125
29-1125.01,Art Therapists,19155,"Conduct information sharing sessions, such as in-service workshops for other professionals, potential client groups, or the general community.",Core,21,07/2014,Occupational Expert,291125
29-1125.01,Art Therapists,19152,Photograph or videotape client artwork for inclusion in client records or for promotional purposes.,Supplemental,21,07/2014,Occupational Expert,291125
29-1125.01,Art Therapists,19156,Coordinate art showcases to display artwork produced by clients.,Supplemental,21,07/2014,Occupational Expert,291125
29-1125.01,Art Therapists,19157,Coordinate field trips for client groups to museums or other public displays of art.,Supplemental,21,07/2014,Occupational Expert,291125
29-1125.02,Music Therapists,19179,"Design or provide music therapy experiences to address client needs, such as using music for self-care, adjusting to life changes, improving cognitive functioning, raising self-esteem, communicating, or controlling impulses.",Core,25,07/2014,Occupational Expert,291125
29-1125.02,Music Therapists,19167,"Assess client functioning levels, strengths, and areas of need in terms of perceptual, sensory, affective, communicative, musical, physical, cognitive, social, spiritual, or other abilities.",Core,25,07/2014,Occupational Expert,291125
29-1125.02,Music Therapists,19178,"Sing or play musical instruments, such as keyboard, guitar, or percussion instruments.",Core,25,07/2014,Occupational Expert,291125
29-1125.02,Music Therapists,19171,"Design music therapy experiences, using various musical elements to meet client's goals or objectives.",Core,56,07/2014,Occupational Expert,291125
29-1125.02,Music Therapists,19182,"Document evaluations, treatment plans, case summaries, or progress or other reports related to individual clients or client groups.",Core,25,07/2014,Occupational Expert,291125
29-1125.02,Music Therapists,19181,"Communicate with clients to build rapport, acknowledge their progress, or reflect upon their reactions to musical experiences.",Core,56,07/2014,Occupational Expert,291125
29-1125.02,Music Therapists,19176,"Observe and document client reactions, progress, or other outcomes related to music therapy.",Core,56,07/2014,Occupational Expert,291125
29-1125.02,Music Therapists,19173,"Establish client goals or objectives for music therapy treatment, considering client needs, capabilities, interests, overall therapeutic program, coordination of treatment, or length of treatment.",Core,56,07/2014,Occupational Expert,291125
29-1125.02,Music Therapists,19172,"Engage clients in music experiences to identify client responses to different styles of music, types of musical experiences, such as improvising or listening, or elements of music, such as tempo or harmony.",Core,56,07/2014,Occupational Expert,291125
29-1125.02,Music Therapists,19170,"Customize treatment programs for specific areas of music therapy, such as intellectual or developmental disabilities, educational settings, geriatrics, medical settings, mental health, physical disabilities, or wellness.",Core,25,07/2014,Occupational Expert,291125
29-1125.02,Music Therapists,19177,"Plan or structure music therapy sessions to achieve appropriate transitions, pacing, sequencing, energy level, or intensity in accordance with treatment plans.",Core,56,07/2014,Occupational Expert,291125
29-1125.02,Music Therapists,19175,"Improvise instrumentally, vocally, or physically to meet client's therapeutic needs.",Core,56,07/2014,Occupational Expert,291125
29-1125.02,Music Therapists,19169,"Confer with professionals on client's treatment team to develop, coordinate, or integrate treatment plans.",Core,56,07/2014,Occupational Expert,291125
29-1125.02,Music Therapists,19188,"Integrate behavioral, developmental, improvisational, medical, or neurological approaches into music therapy treatments.",Core,56,07/2014,Occupational Expert,291125
29-1125.02,Music Therapists,19168,"Communicate client assessment findings and recommendations in oral, written, audio, video, or other forms.",Core,56,07/2014,Occupational Expert,291125
29-1125.02,Music Therapists,19180,"Select or adapt musical instruments, musical equipment, or non-musical materials, such as adaptive devices or visual aids, to meet treatment objectives.",Core,56,07/2014,Occupational Expert,291125
29-1125.02,Music Therapists,19166,Analyze or synthesize client data to draw conclusions or make recommendations for therapy.,Core,56,07/2014,Occupational Expert,291125
29-1125.02,Music Therapists,20167,Participate in continuing education.,Core,25,07/2014,Occupational Expert,291125
29-1125.02,Music Therapists,19165,Analyze data to determine the effectiveness of specific treatments or therapy approaches.,Core,56,07/2014,Occupational Expert,291125
29-1125.02,Music Therapists,19184,"Compose, arrange, or adapt music for music therapy treatments.",Core,56,07/2014,Occupational Expert,291125
